term_id,preferred_term,part_of_speech,definition,usage_context,forbidden_variants,status,severity,source_locations
current-datetime-result,current date and time,noun phrase,"The date-and-time value returned to the user for a requested location, including both calendar date and clock time.","User Story 1 narrative and Acceptance Scenarios 1-2 output description",current time,approved,behavioral,"spec.md — Title (""Get Current Time for Location""); spec.md — User Story 1 narrative; spec.md — AS1, AS2; spec.md — Success Criteria bullet 1"
timezone-input-identifier,IANA timezone identifier,noun phrase,"The canonical machine-readable timezone identifier (e.g., ""America/New_York"") accepted as one form of location input, per the IANA Time Zone Database.","Functional Requirement FR-001; Acceptance Scenario 1's example input","timezone (bare, when referring specifically to the input format)",approved,behavioral,spec.md — FR-001; spec.md — AS1
timezone-output-representation,"PROVISIONAL — return both an IANA timezone identifier field and a timezone abbreviation field",noun phrase,"The timezone-related value(s) shown to the user in a lookup response. AS1 only specifies an ""abbreviation"" (e.g., ""EST""); the spec never confirms whether the underlying IANA identifier is also returned.","Acceptance Scenario 1 output description","timezone (bare, undifferentiated from timezone-input-identifier)",provisional,behavioral,spec.md — AS1
location-query-scope-country,"PROVISIONAL — country name, resolved to one or more timezones",noun phrase,"Country-based location input named as an accepted identifier type and referenced in an edge case, but with no corresponding Functional Requirement mandating support for it.","User Story 1 narrative; Edge Cases",none — completeness gap not a wording conflict,provisional,behavioral,"spec.md — User Story 1 narrative; spec.md — Edge Cases (""Country has multiple timezones"")"
error-message-requirement-gap,"PROVISIONAL — helpful, actionable error message for invalid or ambiguous location input",noun phrase,"Error-message behavior required by Acceptance Scenario 3 and the Success Criteria, but with no corresponding Functional Requirement.","Acceptance Scenario 3; Success Criteria bullet 3",none — completeness gap not a wording conflict,provisional,behavioral,spec.md — AS3; spec.md — Success Criteria bullet 3
us-zip-code,US zip code,noun phrase,A 5-digit United States postal code accepted as a location identifier and resolved to the corresponding timezone.,Functional Requirement FR-003; Acceptance Scenario 2,zip code (shorthand only acceptable after the first full-form use),approved,behavioral,spec.md — FR-003; spec.md — AS2
location,location,noun,"The umbrella input value the user supplies to look up a time — one of: IANA timezone identifier, city name, country, or US zip code.","User Story 1 narrative, Acceptance Scenarios, Edge Cases",identifier (used once in the User Story narrative for the same concept — keep ""location"" as the consistent term for generated field/parameter names),approved,behavioral,"spec.md — User Story 1 narrative (""identifier""); spec.md — AS3, Edge Cases (""location"")"
