term_id,preferred_term,part_of_speech,definition,usage_context,forbidden_variants,source_locations
appearance-setting,appearance setting,noun,"The stored per-user light/dark choice, extended by this change with a `system` value resolved against the OS.","Base spec requirements; the concept behind the change's toggle, persistence, and system option",theme preference (pending an explicit rename in the delta),"openspec/specs/appearance/spec.md — Requirement: Appearance Setting; proposal.md — Approach (""reuses the stored value"")"
setting-persistence,Setting Persistence,proper noun,"The base spec requirement title for applying the saved appearance setting on every new session; MODIFIED delta headers must match it exactly.",Requirement headers in the appearance domain,Preference Persistence,"openspec/specs/appearance/spec.md — Requirement: Setting Persistence"
system-value,system,proper noun,"The added appearance-setting value that follows the operating system's color scheme, resolved at render time.",Delta ADDED requirement; proposal Scope,,"specs/appearance/spec.md (delta) — Requirement: System Option; proposal.md — Scope"
theme-toggle,ThemeToggle,proper noun,"The settings-UI component implementing the manual toggle for the appearance setting; bridge to the proposal is stated in the design.",design.md decisions and File Changes; tasks 2.1,,"design.md — Decision: CSS custom properties...; tasks.md — Task 2.1"
dark-palette,dark palette,noun,"The dark color set applied via CSS custom properties when the resolved appearance is dark.",Base and delta scenarios; tasks 1.2,,"openspec/specs/appearance/spec.md — Scenario: Returning user; tasks.md — Task 1.2"
